author,downs,edited,is_original_content,media_only,name,num_comments,permalink,selftext,subreddit,title,ups
projectxama,0,1540526836.0,False,False,t3_9rhgeq,29,/r/LosAngeles/comments/9rhgeq/beverly_hills_isnt_a_city_its_a_tax_shelter/,"The time has come to stop these subway-stopping, Trump loving, water wasting, Saudi sheltering goofs. The city of Los Angeles, if it had any guts, would repatriate Beverly Hills and tax the hell out of the millionaires and billionaires who live there. L.A. could afford to fix every road, to fund every hospital and school, and to clean up our streets if these rich goofballs didn't cloister themselves into their own fake city.

We likely won't see this happen from our current spineless government, but if there's one  thing I know about civics, it's that money talks. When the next financial crisis hits and the people of L.A. hurt, look no further than the hoarders of Beverly Hills.",LosAngeles,Beverly Hills isn't a city. It's a tax shelter,0
AlsoNotForMe,0,False,False,False,t3_9r0efw,26,/r/LosAngeles/comments/9r0efw/til_contrary_to_popular_belief_there_are_no/,,LosAngeles,"TIL contrary to popular belief, there are no native populations of Brown Recluse spiders in California",50
westondeboer,0,False,False,False,t3_9r3dqw,4,/r/LosAngeles/comments/9r3dqw/fbi_arrests_white_nationalist_leader_who_fled_the/,,LosAngeles,F.B.I. Arrests White Nationalist Leader Who Fled the Country for Central America,19
Eurynom0s,0,False,False,False,t3_9r2685,32,/r/LosAngeles/comments/9r2685/santa_monica_ballot_measure_would_require/,,LosAngeles,"Santa Monica ballot measure would require ‘supermajority’ vote for taller, denser buildings",24
lurker_bee,0,False,False,False,t3_9r5mya,1,/r/LosAngeles/comments/9r5mya/santa_monica_city_employee_accused_of_molesting/,,LosAngeles,Santa Monica City Employee Accused of Molesting Kids While Volunteering in the 1990s Faces Charges: Sheriff,8
Eperluya23,0,False,False,False,t3_9r5b32,0,/r/LosAngeles/comments/9r5b32/the_arboretum_bonatic_garden_los_angeles/,,LosAngeles,The Arboretum &amp; Bonatic Garden Los Angeles California,8
AtmanRising,0,False,False,False,t3_9r308f,0,/r/LosAngeles/comments/9r308f/southern_californiabased_white_supremacist_group/,,LosAngeles,"Southern California-based white supremacist group leader, 2 members arrested in Los Angeles",14
_Mechaloth_,0,False,False,False,t3_9r5ne1,0,/r/LosAngeles/comments/9r5ne1/we_used_archival_materials_to_decorate_a_small/,,LosAngeles,We used archival materials to decorate a small area on the LACMA campus for Halloween,7
Kilodom,0,False,False,False,t3_9r6sn8,0,/r/LosAngeles/comments/9r6sn8/horror_nights/,Hey guys trying to sell a horror nights ticket for horror nights. I'll be selling it for 70 dollars PM if interested. The day is for tomorrow Thursday the 25th let me know if interested ASAP.,LosAngeles,Horror Nights,5
WriterDave,0,False,False,False,t3_9r1ksc,16,/r/LosAngeles/comments/9r1ksc/psa_this_saturday_is_national_prescription_drug/,,LosAngeles,"PSA: this Saturday is National Prescription Drug Take Back Day where you can safely dispose of of any unwanted, unused or expired prescription medications in your home.",18
VUELO_LA,0,False,False,False,t3_9qv1bv,17,/r/LosAngeles/comments/9qv1bv/blitzkrieg_in_agoura_hills/,,LosAngeles,Blitzkrieg in Agoura Hills,312
AsianRainbow,0,False,False,False,t3_9r0d3e,2,/r/LosAngeles/comments/9r0d3e/man_shot_and_killed_in_possible_carjacking_in/,,LosAngeles,Man shot and killed in possible car-jacking in Woodland Hills,20
BeerNTacos,0,False,False,False,t3_9r34p2,1,/r/LosAngeles/comments/9r34p2/not_so_boston_market_pops_up_in_la/,,LosAngeles,'Not So Boston' Market Pops Up in LA,10
gammapsi05,0,False,False,False,t3_9r26dq,5,/r/LosAngeles/comments/9r26dq/3_winning_mega_millions_ticket_sold_in_los/,,LosAngeles,3 Winning Mega Millions Ticket Sold in Los Angeles County,11
Jorna1416,0,False,False,False,t3_9qs268,39,/r/LosAngeles/comments/9qs268/only_in_la/,,LosAngeles,Only in LA,726
BeerNTacos,0,False,False,False,t3_9r39gp,1,/r/LosAngeles/comments/9r39gp/la_parking_manager_who_parked_cars_in_city_lot/,,LosAngeles,LA Parking Manager Who Parked Cars In City Lot For Free Fined $16K,8
BeerNTacos,0,False,False,False,t3_9r392r,0,/r/LosAngeles/comments/9r392r/meet_sherlock_la_countys_new_k9_with_a_nose_for/,,LosAngeles,"Meet Sherlock, LA County's New K9 With a Nose for Fighting Crime",6
hound_dog_pope,0,False,False,False,t3_9r3o91,15,/r/LosAngeles/comments/9r3o91/westwoodcentury_city_lookout_for_possible_scam/,"Hey everyone.  I wanted to post about something unusual that happened to me yesterday (10/23) near the intersection of Westwood Blvd. and Ohio Ave.  I think it might have been a scam, so I wanted to try and make the community aware of it.  Mods, if this is a common scam and I'm just naïve, or if this isn't the kind of thing that belongs on this sub, please just PM me and I'll get rid of it.

As I was pulling into a grocery store parking lot, a guy approached me asking about the fender on my vehicle.  I was frankly surprised he'd noticed it, the damage to the panel was pretty slight.  A couple months ago I'd hit a shopping cart that someone had """"""""conveniently"""""""" left in a parking place just where I couldn't see it as I was pulling in.  Part of the cart got wedged between the left front fender panel and the left front tire. It dislocated the panel, pulling it away from the chassis a bit.  It's not an obvious defect, but if you examine the car closely you can see that the panel isn't flush with the headlight, nor the seam where it should meet the adjacent panel. 

This guy told me that he freelanced doing auto body repairs, and said that he could pop the panel back into place in the parking lot, right then and there.  Since it seemed like a superficially simple repair, I decided to give it a shot (stupid, I know). He produced this device from his trunk (it looked like a giant screwdriver with a threaded screw at the end) and instructed me to turn my car's wheel completely to the right.  He slid the device into the wheel well until he had some purchase on the metal panel, and then he started jerking on the device and pressing his foot against the car for leverage.  After a minute of doing this, it became clear that he wasn't making progress - the panel still wasn't flush with the rest of the car.  In a way, this confirmed my worst suspicion about the damage to the panel: that the steel itself had been bent, and this wasn't simply a matter of popping the panel back into place.

I asked him to stop, saying this clearly wasn't effective.  Instead of stopping though, he went back into his truck, and pulled out a spray can and some Bondo.  He smeared Bondo all over the seam between the damaged panel and the rest of the car.  He then sprayed over the Bondo with some orangish-red automotive paint.  He kept telling me that I could call him on Saturday and he would buff out everything and make it look perfect.  This was when the red flags really started to accumulate.  

At this point, I was really frustrated.  It was clear this guy didn't know what he was doing, and now he was saying that I needed to call him on Saturday for additional work.  Then the biggest red flag of all: he starts demanding the full price of the ""work"" he'd done right there in the parking lot. The price? $350! I told him to get lost.  Smearing Bondo and mismatched paint on someone's car, and then asking for the full price before the work was done?  I guess I must not be the smartest person in the world for letting things get this far, but I'm not that stupid.  I told him I'd give him a small down payment for the ""future work"" on Saturday (I was trying to get him to leave me alone at this point).  I gave him a few bucks, which is a lot of money to give someone for the privilege of having your car made to look like the handiwork of a third world chop shop (no offense to third world chop shops, I'm sure they do better work than this guy).

Then came more red flags - he starts complaining about how that wasn't enough money, and how he'd been using ""high-quality materials"" there in the parking lot.  Even though the can he'd been using clearly said ""Bondo"" on it, he insisted that it was some kind of special fiberglass compound that was superior to Bondo.  Eventually, he relented, took the few bucks I'd given him and left.  

What's embarrassing is that I like to think I'm pretty immune to nonsense like this.  In hindsight, it was obvious that he was using two pretty well-known psychological tricks: the anchoring effect (he gets me to try and talk him down from an ""anchoring"" price of $350 dollars, when I shouldn't have given him anything) and a kind of ""monkey trap"" fallacy (now that your car has cosmetic damage, I'm the only one who can fix it, keep paying me until it's better).  What's sad is I studied this stuff in graduate school and I still fell for it :(  

Anyway, be on the lookout.  He was probably in his 40's, about 5'9"" was driving a late-model cream-colored Mercedes Benz.  I think he was either Middle-Eastern or Latin American, but no accent.  Had black, wavy hair that almost covered his ears, and his face was a little bit pock-marked.

**TL;DR:** Guy is going around offering to ""repair"" cosmetic damage to vehicles in parking lots, barely does anything, tries to get money from you after damaging your car.",LosAngeles,Westwood/Century City: Lookout for Possible Scam,6
ExcitedCurtain_864,0,1540496566.0,False,False,t3_9rb7c5,24,/r/LosAngeles/comments/9rb7c5/whats_the_best_way_to_get_to_ktown_straight_from/,"I have been commuting from the valley to North Hollywood, then to K-town for the past couple months and I don’t think I can stand the red line metro anymore. I’m hoping there’s still a way around it that will make my daily commute a little less uncomfortable. Getting a car is my last resort. If driving is necessary, I’m open to tips about carshare/rideshare services as well. Thank you in advance!",LosAngeles,What’s the best way to get to K-town straight from North Hollywood without having to drive or take the Metro?,0
fruitdeeler,0,False,False,False,t3_9r5d2l,4,/r/LosAngeles/comments/9r5d2l/earthquake_in_southbay/,Felt a jolt in Torrance. Maybe I was dreaming?,LosAngeles,earthquake in southbay?,3
crestonfunk,0,False,False,False,t3_9r3kfv,3,/r/LosAngeles/comments/9r3kfv/anyone_know_about_lapd_activity_with_helicopter/,,LosAngeles,Anyone know about LAPD activity with helicopter at Charnock Elementary.,5
MatthewDM111,0,False,False,False,t3_9qpmmw,137,/r/LosAngeles/comments/9qpmmw/autumn_view_from_my_studio_in_old_town_pasadena/,,LosAngeles,Autumn view from my studio in Old Town Pasadena.,1108
BlankVerse,0,False,False,False,t3_9r26ny,11,/r/LosAngeles/comments/9r26ny/chili_cheese_beef_tamales_return_to/,,LosAngeles,"Chili Cheese Beef Tamales Return To Wienerschnitzel On October 30, 2018",5
TTDILA,0,False,False,False,t3_9r2664,0,/r/LosAngeles/comments/9r2664/things_to_do_in_los_angeles_weekly_what_to_do/,,LosAngeles,Things To Do In Los Angeles: Weekly What To Do: Conventions and Such [ my site],7
PapaPimp117,0,False,False,False,t3_9r1dje,11,/r/LosAngeles/comments/9r1dje/sources_for_mechanics_that_will_check_out_cars/,"Looking at cars and trucks on Craigslist. 



Btw i love this sub haha ",LosAngeles,Sources for mechanics that will check out cars before you buy them?,11
BKlounge93,0,False,False,False,t3_9qt4vy,42,/r/LosAngeles/comments/9qt4vy/boyle_hotel_in_boyle_heights_1895_2018/,,LosAngeles,Boyle Hotel in Boyle Heights - 1895 &amp; 2018,296
Dmachine_Blizz,0,False,False,False,t3_9r6u84,0,/r/LosAngeles/comments/9r6u84/world_of_warcraft_fans_tickets_for_arena_world/,,LosAngeles,World of Warcraft Fans: Tickets for Arena World Championship Global Finals at the Blizzard Arena are still available!,1
AutoModerator,0,False,False,False,t3_9qzhpm,123,/r/LosAngeles/comments/9qzhpm/los_angeles_daily_discussion_thread_1024/,"Rules are simple:

* Talk about whatever's on your mind
* **Be excellent to each other.**

Pretty simple. Have a blast

 
",LosAngeles,Los Angeles daily discussion thread 10/24,15
manchegoo,0,False,False,False,t3_9r34er,2,/r/LosAngeles/comments/9r34er/just_saw_la_bomb_squad_heading_west_on_the_10_in/,,LosAngeles,Just saw LA Bomb squad heading west on the 10 in West LA. Anyone know what’s going on?,4
damnthathamcam,0,False,False,False,t3_9qt9il,39,/r/LosAngeles/comments/9qt9il/wwii_plane_just_crashed_on_the_101_photo_credit/,,LosAngeles,WWII Plane just crashed on the 101. Photo credit belongs to twitter user @colepuente,260
Ike_Lawliet,0,False,False,False,t3_9r5ym7,4,/r/LosAngeles/comments/9r5ym7/anyone_know_a_good_cosplay_wig_stylist/,Title! Looking for a good local LA stylist to style a wig I have already to look like Mercy from Overwatch. Thanks for any help!,LosAngeles,Anyone know a good cosplay wig stylist?,0
tifuforreal,0,False,False,False,t3_9qwh5x,30,/r/LosAngeles/comments/9qwh5x/the_lakers_were_not_interested_in_celebrating/,,LosAngeles,The Lakers were not interested in celebrating with a fan who hit a $30K half-court bucket,49
moonhattan,0,False,False,False,t3_9r45zf,8,/r/LosAngeles/comments/9r45zf/truck_dented_the_building_real_bad_on_wilshire/,,LosAngeles,Truck dented the building real bad on Wilshire Blvd. Hope everyone's ok.,3
AmeriChaos,0,False,False,False,t3_9qww1r,3,/r/LosAngeles/comments/9qww1r/confirmed_cause_of_plane_crash_on_the_101_today/,,LosAngeles,Confirmed cause of plane crash on the 101 today.,43
esotouric_tours,0,False,False,False,t3_9qx3yg,6,/r/LosAngeles/comments/9qx3yg/newly_digitized_16mm_film_of_a_wild_car_ride_in/,,LosAngeles,Newly digitized 16mm film of a wild car ride in 1932 Downtown L.A.,36
heykarlll,0,False,False,False,t3_9r5q47,6,/r/LosAngeles/comments/9r5q47/the_complete_list_of_la_times_endorsements_for/,,LosAngeles,The complete list of L.A. Times endorsements for the November 6 election - Los Angeles Times,3
MatthewRB33,0,False,False,False,t3_9qvsw7,48,/r/LosAngeles/comments/9qvsw7/grand_central_market_is_fascinating_i_went_there/,,LosAngeles,"Grand Central Market is fascinating, I went there over the weekend for the fist time and it was an awesome experience",62
dadanoh0,0,1540429077.0,False,False,t3_9r5gt5,5,/r/LosAngeles/comments/9r5gt5/earthquake_or_was_that_just_me/,"Fellow LA'liens,

Did anyone feel a half-second jolt about 15 minutes ago? Just wondering if I'm going crazy by myself. On a better note we are almost done with hump day(:

&amp;#x200B;

edit: USGS confirmed. 2.4 San Pedro, Ca",LosAngeles,earthquake or was that just me?,0
sawahaa,0,1540400965.0,False,False,t3_9r1f7v,22,/r/LosAngeles/comments/9r1f7v/mental_health_and_proposition_2_on_ca_state_ballot/,"Asking my fellow angelenos what you all think about proposition 2 from a mental health funding standpoint. 

From what I understand, this prop will take away existing mental health funds to pay off a supporting housing bond? 

Why should homelessness be solved at the cost of basic mental health treatment?? 

I’m sorry, but something doesn’t add up here. 

Advice, comments, arguments for/against, all welcome.

Thanks! ",LosAngeles,Mental Health and Proposition 2 on CA State Ballot,6
numbing94,0,False,False,False,t3_9r4x7y,7,/r/LosAngeles/comments/9r4x7y/largest_daiso_in_socalorange_county/,TY and have a nice day. :),LosAngeles,Largest Daiso in SoCal/Orange County?,0
TwoMysticalOrbs,0,False,False,False,t3_9r2xss,10,/r/LosAngeles/comments/9r2xss/are_prop_10s_bigmoney_foes_making_californias/,,LosAngeles,Are Prop. 10’s Big-Money Foes Making California’s Housing Problem Worse?,3
myfanclicks,0,False,False,False,t3_9r4tiq,7,/r/LosAngeles/comments/9r4tiq/question_about_section_8_in_city_of_la_and/,"I’m asking for a friend (we’ll call her Mimi) and her neighbor (Fred). Their apartment building in El Sereno was just put up for sale and Fred is scared and anxious. He is currently receiving Sec 8 (through city of LA) and he has a son with special medical needs. He heard from someone that in Highland Park, families are being priced out of their apartments after getting moved temporarily to a hotel while the new owners remodel. They are allowed to come back but suddenly the rent is two or three times as much. 

So in order to help Fred, what information should he be aware of? At this time, it’s still too early to know whether it’ll actually sell, and if a new owner wants to just keep things as is or redevelop. The apartment is currently rent controlled. Any information is greatly appreciated. ",LosAngeles,Question about section 8 in City of LA and renters rights when apartment is put up for sale,0
algika,0,False,False,False,t3_9r4ska,0,/r/LosAngeles/comments/9r4ska/california_politics_are_hella_norcal_will_voters/,,LosAngeles,California politics are hella NorCal. Will voters shake that up this year?,0
riffic,0,False,False,False,t3_9r2u28,0,/r/LosAngeles/comments/9r2u28/east_hollywood_hitandrun_leaves_60yearold_woman/,,LosAngeles,East Hollywood hit-and-run leaves 60-year-old woman in critical condition,2
riffic,0,False,False,False,t3_9r2tao,0,/r/LosAngeles/comments/9r2tao/los_angeles_city_council_and_metro_board_plan/,,LosAngeles,"Los Angeles City Council and Metro board plan measures to offer free transit and bike-share rides on Election Day, November 6",3
ThunderHawkLives,0,False,False,False,t3_9r7pye,14,/r/LosAngeles/comments/9r7pye/best_vegan_hot_wings_in_la/,Thanks in advance.,LosAngeles,Best vegan hot wings in LA?,0
itmesmiley,0,False,False,False,t3_9r6upu,5,/r/LosAngeles/comments/9r6upu/one_of_these_is_not_like_the_other/,,LosAngeles,One of these is not like the other...,0
midcityjuan,0,False,False,False,t3_9qxolm,30,/r/LosAngeles/comments/9qxolm/person_shot_killed_on_sidewalk_in_baldwin_hills/,,LosAngeles,"Person shot, killed on sidewalk in Baldwin Hills",14
joeforshow,0,False,False,False,t3_9qwh4w,6,/r/LosAngeles/comments/9qwh4w/it_beginspublic_transit_talks_smack_world_series/,,LosAngeles,It Begins...Public Transit Talks Smack (World Series Edition),25
brendo12,0,False,False,False,t3_9qrrq2,28,/r/LosAngeles/comments/9qrrq2/95_lunch_and_dinner_today_at_my_familys/,,LosAngeles,$.95 lunch and dinner today at my family’s restaurant El Cholo for our 95th Anniversary! 3 locations in LA 3 in Orange County,134
LittlleJewBitch,0,False,False,False,t3_9r9rum,21,/r/LosAngeles/comments/9r9rum/moving_to_la_10_grand_in_pocket/,"I am planning on moving there in February with 10GS. I live in northern CA so I'm somewhat used to the higher rent (although it's still fairly cheap) and I have a car. How well off will I be, should I stay a couple more months and save up a few more grand? PS. I'm ready for all the hate, I've seen some of the other posts",LosAngeles,Moving to LA 10 Grand in pocket,0
blackjackel,0,False,False,False,t3_9r84gx,7,/r/LosAngeles/comments/9r84gx/damn_rla_you_scary/,"Does anyone else feel like r/losangeles has turned into the 10 Oclock nightly news with all the scary shit posted? I mean, there's not a whole lot of it like there is on the nightly news, but there's more than there used to be.

Damn r/LA You Scary...",LosAngeles,Damn r/LA You Scary...,0
BeerNTacos,0,False,False,False,t3_9r3mci,1,/r/LosAngeles/comments/9r3mci/the_harsh_reality_why_this_high_profile_chef/,,LosAngeles,The Harsh Reality: Why This High Profile Chef Helped Her Employee's Relative Escape El Salvador,0
theterz,0,False,False,False,t3_9qpyyo,118,/r/LosAngeles/comments/9qpyyo/good_morning_la/,,LosAngeles,Good morning LA!,225
stomper2loko,0,False,False,False,t3_9qunlo,28,/r/LosAngeles/comments/9qunlo/la_vibes/,,LosAngeles,LA VIBES,41
DMAS1638,0,False,False,False,t3_9qty6d,13,/r/LosAngeles/comments/9qty6d/things_seen_this_week_during_structural/,,LosAngeles,Things seen this week during structural inspections (Spooky edition... Seriously),53
BeerNTacos,0,False,False,False,t3_9r3er8,0,/r/LosAngeles/comments/9r3er8/remember_me_the_ultimate_guide_to_dia_de_los/,,LosAngeles,Remember Me: The Ultimate Guide to Dia de los Muertos Events in Los Angeles ~ GTFO LA! ~ L.A. TACO,2
banjo_exe,0,False,False,False,t3_9r7v53,8,/r/LosAngeles/comments/9r7v53/best_hairstylists_in_the_pasadena_north_east_la/,,LosAngeles,Best hairstylists in the Pasadena/ north east la area? Looking to get as close to this as possible. I trust reddit more than yelp.,0
ilovemrhandsome,0,False,False,False,t3_9qx13y,25,/r/LosAngeles/comments/9qx13y/shady_voice_mail_left_by_the_from_the/,,LosAngeles,Shady voice mail left by the from the pro-Proposition 6 group. Alluding that there is an error on the ballots sent out.,13
adonisgq1,0,False,False,False,t3_9qw6eh,4,/r/LosAngeles/comments/9qw6eh/plane_crash_on_the_101_in_los_angeles_video_shot/,,LosAngeles,Plane crash on the 101 in Los Angeles - video shot 10-23-18 at 3:15pm Pacific [OC],19
savedbythebeard,0,False,False,False,t3_9qul4m,8,/r/LosAngeles/comments/9qul4m/ventured_out_to_camarillo_recently_to_explore_the/,,LosAngeles,Ventured out to Camarillo recently to explore the supposedly haunted Scary Dairy. Album in comments.,32
silvs1,0,False,False,False,t3_9qv4m4,0,/r/LosAngeles/comments/9qv4m4/dodger_stadium_express_is_all_ready_to_go_for/,,LosAngeles,Dodger Stadium Express is all ready to go for Friday!,23
gammapsi05,0,False,False,False,t3_9qsfzy,13,/r/LosAngeles/comments/9qsfzy/6_gang_members_face_over_60_felonies_in/,,LosAngeles,6 Gang Members Face Over 60 Felonies In Home-Invasion Robbery Spree Across LA County: Sentences Range from 9 to 196 years,60
PM_ME_KITTEN_TOESIES,0,False,False,False,t3_9qvc96,27,/r/LosAngeles/comments/9qvc96/i_just_won_a_ride_with_angelyne_on_sunday/,"What should I ask her!??

Don’t burst my bubble, I know this is gonna be expensive 😅",LosAngeles,I just won a ride with Angelyne on Sunday!!,18
riffic,0,False,False,False,t3_9qu0a2,3,/r/LosAngeles/comments/9qu0a2/streetsblog_joins_the_la_times_in_endorsing/,,LosAngeles,"Streetsblog joins the L.A. Times in endorsing Measure W, which raises a parcel tax on impermeable surface areas such as Parking Lots to fund water reclamation efforts",33
SupaZT,0,False,False,False,t3_9r1rgr,1,/r/LosAngeles/comments/9r1rgr/proposition_10_californias_rent_control_ballot/,,LosAngeles,"Proposition 10: California’s rent control ballot measure, explained",2
helloitabot,0,False,False,False,t3_9qr9m3,28,/r/LosAngeles/comments/9qr9m3/shoutout_to_the_slumlords_of_hancock_park/,,LosAngeles,Shoutout to the slumlords of Hancock Park,82
Wendigo15,0,False,False,False,t3_9r0zb2,6,/r/LosAngeles/comments/9r0zb2/question_about_retiring_a_car/,"So I have my car as non operation. I know it cost $14 to reinstate it. I know I have to get the smog check for it but do I really need to do all that if I'm retiring it?

Do I have to get new sticker for it as well? What is low come considered? I think I qualify for it.  

How much is all that gonna cost? And what do I need to do in order to get everything done",LosAngeles,Question about retiring a car,1
barbehque,0,False,False,False,t3_9qrxyn,73,/r/LosAngeles/comments/9qrxyn/things_to_do_for_halloween_megathread/,"Feel free to list any party you know of, any event you're throwing, any requests to get together with fellow redditors, all of that goes right here.

#[make sure to check out the Halloween Map](https://www.reddit.com/r/LosAngeles/comments/9l65zp/official_rla_map_halloween_in_los_angeles_2018/) created by /u/405freeway for more ideas.",LosAngeles,Things to do for Halloween megathread.,42
StropkotheDrummer,0,False,False,False,t3_9qu8de,38,/r/LosAngeles/comments/9qu8de/how_to_deal_with_thieves_in_my_neighborhood/,"I live in Echo Park, and we have a bad problem with people breaking windows on my street. (Sunset Blvd.) Multiple people I know have fallen victim to this, and we have reason to believe it’s the same two people doing it every time. We’ve tried filing police reports, but the police do nothing. What are my options here?",LosAngeles,How to deal with thieves in my neighborhood?,19
honeychild7878,0,False,False,False,t3_9qtra0,4,/r/LosAngeles/comments/9qtra0/ca_judicial_candidate_info_voter_guide_resource/,"hey fellow LA folk - I get so frustrated by how little info there is about the Judicial candidates, so I created this spreadsheet with info and links for each candidate.  On the second tab, I have listed many of the voter guides I've found, with some info about what stance political parties, newspapers, non-profits or unions have taken on each proposition.  If there are any mistakes or info missing, let me know.  Hope this helps!

[Link to the Spreadsheet!](https://docs.google.com/spreadsheets/d/1Ycbt_HEhlwb8MTQjk-Fnb7SSn7FXWZMHUELqLmQTYJ0/edit?usp=sharing)
",LosAngeles,CA Judicial Candidate Info &amp; Voter Guide Resource List,21
elvish_visionary,0,False,False,False,t3_9qwekq,15,/r/LosAngeles/comments/9qwekq/how_will_you_be_voting_on_prop_7/,"http://voterguide.sos.ca.gov/propositions/7/

I'm all for eliminating time changes but it seems like we would more likely be a shift to permanent DST rather than get rid of DST and stay on Standard Time all year like Arizona does. I much prefer standard time to DST and so will probably be voting no on this to ensure we at least still have standard time during the winter. Just curious where others stand.",LosAngeles,How will you be voting on Prop 7?,7
Kirkenspiel,0,False,False,False,t3_9qr170,3,/r/LosAngeles/comments/9qr170/lax/,,LosAngeles,LAX,44
westondeboer,0,False,False,False,t3_9qq9ns,25,/r/LosAngeles/comments/9qq9ns/childrens_hospital_la_purchases_east_hollywood/,,LosAngeles,Children’s Hospital L.A. purchases East Hollywood Vons property as it prepares for future growth,55
