author,downs,edited,is_original_content,media_only,name,num_comments,permalink,selftext,subreddit,title,ups
AutoModerator,0,False,False,False,t3_9udcoj,5,/r/LosAngeles/comments/9udcoj/totally_awesome_things_to_do_in_los_angeles_1105/,"What are you doing this week and into the weekend?

Add your events to this thread as well as using [the form.](https://docs.google.com/spreadsheet/viewform?formkey=dC1Fa3VsUFQwU190d2Yydzk1eXd0OGc6MA#gid=0)

Events added via the form can be found on the [spreadsheet](https://docs.google.com/spreadsheet/ccc?key=0AqIa3SPOd2wcdC1Fa3VsUFQwU190d2Yydzk1eXd0OGc&amp;usp=sharing) and [calendar](https://sites.google.com/site/theredditguidetola/)

Happy Fun Times!
",LosAngeles,Totally Awesome Things To Do In Los Angeles 11/05 - 11/11,3
AutoModerator,0,False,False,False,t3_9udcnj,154,/r/LosAngeles/comments/9udcnj/los_angeles_daily_discussion_thread_1105/,"Rules are simple:

* Talk about whatever's on your mind
* **Be excellent to each other.**

Pretty simple. Have a blast

 
",LosAngeles,Los Angeles daily discussion thread 11/05,5
Eurynom0s,0,False,False,False,t3_9ufkdn,85,/r/LosAngeles/comments/9ufkdn/claremont_woman_arrested_for_intentionally/,,LosAngeles,"Claremont woman arrested for intentionally striking, killing bicyclist with vehicle, police say",415
photobucketlist,0,False,False,False,t3_9uhk2x,7,/r/LosAngeles/comments/9uhk2x/i_had_a_chance_to_hike_the_hollywood_sign_while/,,LosAngeles,I had a chance to hike the Hollywood Sign while visiting and wasn’t disappointed with the view.,56
gratethenate,0,False,False,False,t3_9uaboh,16,/r/LosAngeles/comments/9uaboh/at_the_end_of_santa_monica_pier/,,LosAngeles,At the end of Santa Monica Pier,1049
lurker_bee,0,False,False,False,t3_9ugy6w,7,/r/LosAngeles/comments/9ugy6w/costa_mesa_fire_captain_dies_after_being_struck/,,LosAngeles,Costa Mesa Fire Captain Dies After Being Struck by Suspected DUI Driver While Cycling,55
Kirkenspiel,0,False,False,False,t3_9uh413,9,/r/LosAngeles/comments/9uh413/i_love_this_city/,,LosAngeles,I love this city,32
ThomasJenkins5777,0,False,False,False,t3_9uebhy,91,/r/LosAngeles/comments/9uebhy/paraplegic_woman_sues_bird_scooters_and_city_of/,,LosAngeles,Paraplegic Woman Sues Bird Scooters and City of Beverly Hills for Discriminating Against the Disabled,71
burgnotice,0,1541443413.0,False,False,t3_9ug39x,21,/r/LosAngeles/comments/9ug39x/ama_the_midterm_election_is_tomorrow_and_we_built/,"Mornin' /r/LosAngeles, we're the team behind [The Burg](https://burg.community/blog/2018/11/4/the-future-of-voting-is-here). The three of us (Matthew, Kai, &amp; Fernando) are UCLA alums and from all over LA County, from Northridge to South Gate. Our mission is to solve the problem of why it's absurdly difficult and incredibly boring to learn about, let alone vote in LA. We built an app, a new front page of your city, that funnels in all bits of local info (local news, soapboxes, events, ballot info) and access to representatives and community orgs directly to the voters and residents of LA County. We're trying a whole bunch of new cool civic stuff, like hosting digital town halls (civic AMAs) with reps and orgs– shout out to u/LACBP and Long Beach Mayor Robert Garcia for hosting the first ones. Councilman Paul Koretz is next up for all of you on the Westside!

There simply isn't any follow through after you register to vote. Most young folks register on a college campus or the DMV and then do nothing civic until an election shows up 4 years later. There aren't any easy, quick ways to know what's happening in your district or city IRL, never mind meeting your neighbors or knowing your city council-person's name. A bad recipe for preparing and sustaining voters in our opinion, so we made a delicious one lol. We equip you with all of the in's and out's of your city, and even verify your voter status from the get-go so your reps and neighbors can see that you are a verified voter and hold a lot of power.

We're here today to introduce the 2.0 version of our Ballot Info Tool for the Midterms! Big thank you to many of the early users who joined from the sub and gave us ways to improve the Tool. We don't collect your data to sell it to advertisers or anything like that. We only ask for your info so we can properly place you in your city and display your specific ballot information, and hope to run polls down the line! Ok, enough chit-chat here's how it'll help you vote, and vote prudently:

* Worked with Ballotpedia &amp; Voter's Edge to provide clear, **nonpartisan 1-liners for each YES/NO** for every ballot measure– including all City and County measures in LA County
* After you comb through the ballot, you can **make your votes right then and there** and see what percentage of % of LA agrees with you
* We give you your **polling location** and connect you with **Uber &amp; Lyft** so you can ride-share straight to the polls
* Voters and residents can c**omment and converse with everyone in LA County** about each race and measure, and pool your knowledge. Feel free to drop in your fav resources, articles, and links that add to each ballot item.
* **Share specific props** and races to friends &amp; family in LA and get out the vote!

TL;DR: We built an app, The Burg, for [iOS](https://itunes.apple.com/us/app/the-burg-your-communitys-app/id1324715693?ls=1&amp;mt=8) and [Android](https://play.google.com/store/apps/details?id=com.burg.mobile) that connects you to the information, people, and reps in LA County and we just released our Ballot Info Tool that you can actually bring with you to vote with in your polling booth! Ask us anything!",LosAngeles,"[AMA] The midterm election is tomorrow and we built a ELI5 Ballot Info Tool for LA County. Highlights: aggregates all nonpartisan info &amp; resources, your polling location, and you can even have the app alongside you in the booth to help you vote, Ask Us Anything!",37
hitbunz,0,False,False,False,t3_9uar75,9,/r/LosAngeles/comments/9uar75/downtown_after_the_sunset/,,LosAngeles,Downtown after the sunset,330
somedudeinlosangeles,0,False,False,False,t3_9ugjge,4,/r/LosAngeles/comments/9ugjge/a_reminder_metro_buses_and_trains_are_free/,,LosAngeles,A Reminder: Metro Buses and Trains Are Free Tomorrow So You Should Really Go Vote | LA Magazine,21
xXmgreenXx,0,False,False,False,t3_9uetf0,7,/r/LosAngeles/comments/9uetf0/backyard_views_palos_verdes_cliffs/,,LosAngeles,Backyard views: Palos Verdes Cliffs,30
Eurynom0s,0,False,False,False,t3_9ufmdi,4,/r/LosAngeles/comments/9ufmdi/lame_duck_indiana_congressman_joins_beverly_hills/,,LosAngeles,Lame duck Indiana congressman joins Beverly Hills’ Purple Line fray,23
dirtbagbigboss,0,False,False,False,t3_9uioxc,1,/r/LosAngeles/comments/9uioxc/dsa_los_angeless_2018_general_election_voter_guide/,,LosAngeles,DSA Los Angeles's 2018 General Election Voter Guide,10
soy714,0,False,False,False,t3_9ui4bm,3,/r/LosAngeles/comments/9ui4bm/uber_and_lyft_are_offering_free_or_discounted/,"**Uber** is offering $10 off a single ride to the polls on Election Day on the most affordable Uber option available in your city (Express POOL, POOL or UberX, in that order). The most recent version of the Uber app is needed, and all you do is enter promotional code VOTE2018 in your app. 

**Lyft** is offering 50% off 1 ride per code, with a maximum savings of $5 per code. The codes are valid on Tuesday, 11/06/2018, from 5am to 11:59pm. Open the Lyft app, and under Promos, enter one or more codes.
Confirmed working codes include:

* VoteCA1
* VoteCA2
* VoteCA3
* VoteCA4
* VoteCA5
* VoteCA6
* VoteCA7
* VoteCA8

Encourage your friends, family, and co-workers to go with you and make it a fun trip. Every vote counts!",LosAngeles,Uber and Lyft are offering free or discounted rides on Election Day (tomorrow) here are the codes,5
Kkachko,0,False,False,False,t3_9ufq5t,8,/r/LosAngeles/comments/9ufq5t/lausd_superintendent_plans_to_divide_district/,,LosAngeles,LAUSD superintendent plans to divide district into 32 networks,13
PooPooButterySpread,0,1541462208.0,False,False,t3_9ub5tn,74,/r/LosAngeles/comments/9ub5tn/make_sure_to_vote/,"Hi guys! 

Your neighborhood pollworker here! 

Just wanted to remind you TUESDAY IS ELECTION DAY. We have a lot of great measures and candidates to choose from, no matter what side of the spectrum you're on.

If you're like me, you do a Vote By Mail (VBM), so make sure to turn those in. If you don't want to do a VBM, but signed-up for it and wish to vote in-person at the polls, make sure your bring your VBM and surrender it. If you cannot physically walk into a poll, remember we have curbside voting. If you have arthritis, remember we have those little balls to help your cutie hands! If you are blind or illiterate, remember we have an audio booth! If you don't speak English, we carry instructions in nearly every language! You need a magnifying glass? Guess what! We got that shit, too!

I don't care what you believe in or where you come from, but I care about whether or not you VOTE. Do your research, pick your sides, and get on in there! I love you, you're beautiful, and I can't wait to say ""hi"" to you at the polls on Tuesday should you decide to walk-in (well, if you walk-into my location, at least). VOTE VOTE VOOOOOOTTTTTEEE!!!

Don't forget to tell your friends to vote!! You may also turn your VBM into a polling place if you still haven't got to it and don't want to vote at the polls! EDIT: I THINK I'M ACTUALLY WRONG ON THIS. WE WILL HAVE YOU SURRENDER IT AND YOU WILL NEED TO VOTE AT THE POLLING PLACE. NOT SURE. ANOTHER ELECTION OFFICIAL DOWN THERE SAID WE DO COLLECT 'EM AT THE POLLING PLACE. I CAN'T REMEMBER AND I'M JUST A NEWBIE (MY SECOND ELECTION), SO BE PREPARED FOR EITHER SCENARIO.

Don't forget to grab a sticker! STICKERPALOOOOZAAAA!!!

Lots of exclamation marks in my post but I'm just so excited to see what we do, guys! We're building the world around us and it's gonna be gorgeous!",LosAngeles,MAKE SURE TO VOTE!!!!,112
lightning10000,0,False,False,False,t3_9ugdbm,0,/r/LosAngeles/comments/9ugdbm/little_girl_killed_father_hospitalized_after/,,LosAngeles,"Little Girl Killed, Father Hospitalized After Being Struck By Car in Whittier",11
lotsofthingstohate,0,False,False,False,t3_9ui6du,3,/r/LosAngeles/comments/9ui6du/our_city_from_a_birds_eye_view/,,LosAngeles,Our city from a bird’s eye view,4
VReview,0,False,False,False,t3_9ugogm,1,/r/LosAngeles/comments/9ugogm/related_cos_secures_financing_for_longdelayed/,,LosAngeles,Related Cos. secures financing for long-delayed Grand Avenue project - Los Angeles Times,7
PrecariouslySane,0,False,False,False,t3_9u3h26,83,/r/LosAngeles/comments/9u3h26/i_love_when_you_can_see_dtla_and_the_coast_in_the/,,LosAngeles,I love when you can see DTLA and the coast in the same picture. Any other pics like this?,1820
blackjackel,0,1541461082.0,False,False,t3_9uiu7r,3,/r/LosAngeles/comments/9uiu7r/lets_brainstorm_some_humane_and_fair_laws_to_help/,"I see a lot of arguments and back and forth about the homeless crisis without any actual credible suggestions as how to solve some of these issues.


I like to discuss theoretical and humane solutions to some of these problems. I wish our tax dollars went towards helping the homeless get back on their feet, or even universal basic income, but barring that, what can be done?


If someone provided a solution that you loved or hated, be sure to respond to the comment about why you think it's a great/terrible idea.


I would start by saying the problem first, then providing some solutions. For example:


--------------------


I'd like to address the flea epidemic as well as the garbage on the streets problem. I have several possible solutions for this that are based on MOBILITY. Meaning it will ensure that someone can move with their things if such a need arises.

1- this solution is space based, the homeless would be allowed to retain as many things as can fit inside a 35 gallon trash bags with the bag fully closed and not stretched in any way. This will allow for easy police enforcement.... If it's obvious their things can't fit in a 35 gallon bag then they are required to put their things in a bag provided by the police, and city workers will come dispose of the rest. I think this is more than fair as several backpacking bags can fit inside a 35gal bag, including a tent...etc.

Homeless are allowed two transportation vehicles such as a bicycle which is not included in this restriction.

2- this solution is weight based. The homeless will be allowed any amount of things that they can personally carry, by weight. The police will provide a weighted backpack for testing purposes and a scale. Homeless allowed to keep all items up to that weight and city workers will despose of the rest.

Again transportation vehicles like bikes exempt.",LosAngeles,Let's brainstorm some humane and fair laws to help with the homeless crisis,3
wcg,0,False,False,False,t3_9uj2ha,0,/r/LosAngeles/comments/9uj2ha/kcet_ballot_brief_each_prop_in_1_minute/,,LosAngeles,KCET Ballot Brief - Each Prop in 1 minute,2
hcashew,0,False,False,False,t3_9uh5nj,0,/r/LosAngeles/comments/9uh5nj/in_orange_county_land_of_reinvention_even_its/,,LosAngeles,"In Orange County, land of reinvention, even its conservative politics is changing - Los Angeles Times",3
snow_owl9,0,False,False,False,t3_9uhbqy,14,/r/LosAngeles/comments/9uhbqy/how_to_find_food_trucks_in_la/,What is the best way for tourists to find food trucks in LA? Is there an app? Or some local hotspots? Thanks!,LosAngeles,How to find food trucks in LA?,3
cainstratton,0,False,False,False,t3_9uj4t5,0,/r/LosAngeles/comments/9uj4t5/al_weiss_vs_roger_stuart/,"Hi All,

Which shop do you prefer for suits and why? What are the quality and price differences between the two?

Cain",LosAngeles,Al Weiss vs. Roger Stuart,1
dunaw,0,False,False,False,t3_9uj1ew,1,/r/LosAngeles/comments/9uj1ew/best_omakase_in_the_100150_range/,"Hello! I'm looking to take a friend out for her birthday. She loves Japanese food, so I wanted to surprise her and take her to a good sushi place that offers omakase, or some sort of pre-fixe menu.  She's been to Japan a few times, and she really knows her stuff so the pressure is really on for me. Any help would be greatly appreciated!",LosAngeles,Best Omakase in the $100-$150 range?,1
amerikanss,0,False,False,False,t3_9uiuwp,6,/r/LosAngeles/comments/9uiuwp/smog_looming_over_the_la_skyline_the_other_day/,,LosAngeles,Smog looming over the LA skyline the other day,4
Rhonardo,0,False,False,False,t3_9uii5j,3,/r/LosAngeles/comments/9uii5j/my_event_come_celebrate_election_day_by_playing/,,LosAngeles,[My Event] Come celebrate election day by playing Killer Queen for free at Arts District Brewing Co,0
puphenstuff,0,False,False,False,t3_9ugbng,18,/r/LosAngeles/comments/9ugbng/saw_a_10yo_almost_cause_an_accident_riding_a_bird/,"Felt like beating the living shit out of the punk.  I like the scooters and think everyone should own their own. But things are coming to a boil with the rentals!  The majority of riders seem under 18, and many have two riders, are freewheeling, and most are discarded in driveways and blocking sidewalks etc.   It looks like hardly anyone is using them to offset automobiles....",LosAngeles,"Saw a 10y.o. almost cause an accident riding a Bird against a red light, than cursed at us...wtf?",2
DannyVaaalo,0,False,False,False,t3_9uiac9,3,/r/LosAngeles/comments/9uiac9/food_truck_business/,"My fellow LA Redditors, 

&amp;#x200B;

Does anybody know how Food Trucks are operated?  


Is every food truck a private business or there is a big company behind them, which is managing all the food trucks in LA?

&amp;#x200B;",LosAngeles,Food Truck Business,1
DarkOmen597,0,False,False,False,t3_9ui4u5,2,/r/LosAngeles/comments/9ui4u5/will_californians_turn_out_to_vote_in_the_most/,,LosAngeles,Will Californians Turn Out To Vote In 'The Most Important Election Of Your Life'?,0
dokebibeats,0,False,False,False,t3_9ufy8o,51,/r/LosAngeles/comments/9ufy8o/i_love_guisados_so_much/,,LosAngeles,I love Guisados so much.,3
David12691,0,False,False,False,t3_9ui1gt,0,/r/LosAngeles/comments/9ui1gt/another_photo_of_our_beautiful_sunset_the_other/,,LosAngeles,Another photo of our beautiful sunset the other night.,0
waterboyadam77,0,False,False,False,t3_9uby4r,14,/r/LosAngeles/comments/9uby4r/inexpensive_comedy_spots_in_la/,Looking for some good comedy places that aren’t super expensive and require spending 50 dollars for a good time. Would love to hit the Comedy Store/Laugh Factory all of the time but it’s out of budget. Any suggestions for comedy places I can hit 3-4 times a week that won’t break the bank?,LosAngeles,Inexpensive Comedy Spots in LA,10
thatsmyaibo,0,False,False,False,t3_9u9ezb,83,/r/LosAngeles/comments/9u9ezb/teacherstudent_classroom_brawl_in_maywood/,,LosAngeles,Teacher/Student classroom brawl in Maywood.,34
timboSlice490,0,False,False,False,t3_9uhocl,14,/r/LosAngeles/comments/9uhocl/is_there_a_safe_way_to_find_and_secure_an/,"Two friends and I are planning to move from NJ to LA when our lease is up in May/June.

From what I’ve read, the best way to find an apartment from out of state is to plan a trip out to LA for a week or two and get a feel for the neighborhoods, see the places in person to make sure it’s not a scam, etc.

The issue there is money.. if I was unemployed and had all free time in the world, and had 10 grand on standby, maybe it wouldn’t be an issue but for someone working full time paycheck-to-paycheck, I don’t see how it’s feasible to pay for a round trip ticket to LA, then pay for a week or two in an AirBnB/motel, plus living expenses like food for that time. And that’s not including the actual move (Uhaul expenses, hotels to overnight while driving cross country etc). Also it will be pretty much impossible to schedule off work for a week or two for the scouting trip.

Let’s say just for example the move date would be June 1. Optimistically, and for the sake of the example, say I get a job offer in LA in late May, but obviously don’t get any money from that job until I move there and start working. I can save up a bit of money in the months before the move but that will all go towards the deposit on the new place and the cross country move.

I guess my question is, are there reputable/trustworthy sites where we can find an apartment and lock it down without ever going to LA before the move?",LosAngeles,Is there a safe way to find and secure an apartment in LA from out of state? I’ve heard there are a lot of scam listings in LA on sites like Craigslist.,0
adigitalman,0,False,False,False,t3_9ugjeo,3,/r/LosAngeles/comments/9ugjeo/where_to_buy_go_game_set_in_la/,"Anyone know if there's a physical store in LA I can go buy a Go (Baduk) Set?  Looks like Amazon primarily sells plastic stones and I'm looking for glass or something heavier.  Seems like LA should have something like this, but no idea where to look outside some areas like SGV or Koreatown having these things.",LosAngeles,Where to buy Go Game Set in LA?,1
ItsYourMotherDear,0,False,False,False,t3_9u97rk,4,/r/LosAngeles/comments/9u97rk/costa_mesa_fire_captain_struck_critically_injured/,,LosAngeles,"Costa Mesa Fire Captain Struck, Critically Injured In Suspected DUI Crash",22
OhbamanableSnowman,0,False,False,False,t3_9ua65d,6,/r/LosAngeles/comments/9ua65d/foggy_coast_highway/,,LosAngeles,Foggy Coast Highway,15
RealJakeMusser,0,False,False,False,t3_9u5dpt,13,/r/LosAngeles/comments/9u5dpt/wishing_the_best_for_jillian_barberie_diagnosed/,,LosAngeles,Wishing the best for Jillian Barberie (diagnosed with breast cancer),82
normanbatesmotel,0,False,False,False,t3_9ubx32,2,/r/LosAngeles/comments/9ubx32/los_angles_votes_on_public_bank_this_tuesday/,,LosAngeles,Los Angles Votes On Public Bank This Tuesday,6
ajtyeh,0,False,False,False,t3_9ufhdm,17,/r/LosAngeles/comments/9ufhdm/if_my_dash_cam_and_my_phone_records_a_person_in_a/,I had to scold a man in a red bmw this morning for littering.  Just curious if this person could be fined. Thanks!,LosAngeles,"If my dash cam and my phone records a person in a vehicle in front of me littering, and if i brought that evidence to the local PD, would they do anything?",1
